,job title,salary estimate,job description,rating,company,location,headquarters,company_size,company_founded,company_industry,company_sector,company_revenue
20,#N/A,#N/A,"Join our innovative and collaborative Digital Transformation and Data team. As a Data Scientist, you’ll influence and help Macquarie produce value with data within our Corporate Operations Group and beyond. You will apply your broad data expertise though a mix coaching others, providing strategic advice, and performing hands-on analysis.

You will be responsible for:
Partnering with business leaders and coaching nascent data teams to uplift data capability
Identifying, determining feasibility, and shaping data use cases
Determining appropriate analytical, statistical or machine learning approaches to create value
Performing analysis and creating prototypes
Communicating and influencing outcomes based on data
Providing requirements to, and partnering with, technology/data engineering teams to productionise data prototypes

To be successful in this role you will have the following skills and experience:
Interpreting, telling stories and creating value with data
Curious and business outcome focused with an ability to quickly understand a business area, break down a complex problem and work out how to solve it
Strong collaboration skills having worked with business stakeholders at different levels of seniority and technical proficiency
Comfortable working across a wide range of data sets and systems
Broad understanding of, but not necessarily expertise in, data strategy, data visualisation, data architecture and what is involved in bringing data products into production
Commercial exposure in a corporate, consultancy or start-up environment
Deep practical expertise applying statistical knowledge and machine learning to solve business problems through manipulating and analysing data with SQL and Python or R
Proven track record of overseeing multiple data science projects at all stages, from idea generation to objectives formulation to implementation and deliverables
Excellent project management skills, with a proven track record of on-time and within-budget delivery. Exceptional ability to manage priorities across multiple stakeholders.
About the Corporate Operations Group
The Corporate Operations Group brings together specialist support services in Digital Transformation & Data, Technology, Operations, Human Resources, Business Services, Business Improvement & Strategy, and the Macquarie Group Foundation. We deliver service excellence to ensure Macquarie is open for business, deliver on transformational change, invest in our people and have deep relationships with our customers.
Our COVID-19 policy
In line with local regulations, all Macquarie employees in New York are required to be fully vaccinated against COVID-19 and provide proof of full vaccination in order to attend the office and to participate in external meetings and business travel in New York City, unless a reasonable accommodation is approved or as otherwise required by law. Outside of New York, proof of vaccination is not required to attend a Macquarie office, travel for business, or attend an external business event.
Our commitment to Diversity, Equity and Inclusion
The diversity of our people is one of our greatest strengths. An inclusive and equitable workplace enables us to embrace that diversity to deliver more innovative and sustainable solutions for our people, clients, shareholders and communities. At Macquarie, you'll be encouraged to be yourself and supported to perform at your best. If you're inspired to deliver on our purpose of ‘empowering people to innovate and invest for a better future’, we want you on our team. If you need adjustments made to the recruitment process, please reach out to your recruiter.
All qualified applicants will receive consideration for employment and will not be discriminated against on the basis of race, color, religion, sex, sexual orientation, national origin, age, disability, protected veteran status, genetic information, marital status, gender identity or any other impermissible criterion or circumstance. Macquarie also takes affirmative action in support of its policy to hire and advance in employment of individuals who are minorities, women, protected veterans, and individuals with disabilities.
We equip our people with the support to work in a range of flexible ways. Talk to us about what working arrangements would help you thrive.
Salary range for this position: $108,000 - $192,500/Yr. Actual base salary may vary based upon, but not limited to, relevant experience, time in role, peer and market data, prior performance, business sector, and geographic location. The successful candidate may also be eligible for an annual discretionary incentive compensation award. Macquarie offers a full spectrum of benefits, including Medical, Prescription Drug, Dental, Vision, Health Savings Account, Dependent Day Care Savings Account, Life Insurance, Disability and Other Insurance Plans, Paid Time Off (including Sick Leave, Parental Leave and Vacation), Holidays, 401(k), and Short/Long Term Disability, in addition to other special perks reserved for our employees.

About Macquarie
A career at Macquarie means you’ll have the opportunity to develop and utilise new skills, explore interesting fields and do challenging work that will impact the lives of people around the world—whether it’s accelerating the green energy transition, helping sustain global food supplies, financing social housing projects or investing in essential infrastructure. At Macquarie, we’re empowering people to innovate and invest for a better future.
Our size and international presence means your work can take you anywhere—across business groups, disciplines, sectors and borders. With 18,000+ employees and offices in 33 markets around the world, we’re a truly global organisation.
You’ll be supported by a diverse team where the unique perspectives, ideas and experiences that all of our people bring are valued. You’ll be empowered to address unmet needs in our communities whilst advising and investing alongside our clients and partners. Working with us, you’ll have the opportunity to make a difference.
Macquarie is a global financial group providing clients with asset management, retail and business banking, wealth management, leasing and asset financing, market access, commodity trading, renewables development, specialist advisory, capital raising and principal investment.

Job no: COG-966317
Work type: Permanent - Full time
Location: Houston, New York, Philadelphia
Category: Mid-senior, Technology
Group: Corporate Operations Group
Division: Technology
Recruiter: Ryan Flores
Opening Date: 26/7/2022
Show Less
Report",4.2,"Macquarie Group Limited
4.2","Philadelphia, NY",#N/A,10000+ Employees,1969,Investment & Asset Management,Financial Services,$5 to $10 billion (USD)
21,#N/A,#N/A,"Join a Legacy of Innovation 110 Years and Counting!

Daiichi Sankyo Group is dedicated to the creation and supply of innovative pharmaceutical therapies to improve standards of care and address diversified, unmet medical needs of people globally by leveraging our world-class science and technology. With more than 100 years of scientific expertise and a presence in more than 20 countries, Daiichi Sankyo and its 15,000 employees around the world draw upon a rich legacy of innovation and a robust pipeline of promising new medicines to help people. Under the Group’s 2025 Vision to become a “Global Pharma Innovator with Competitive Advantage in Oncology,” Daiichi Sankyo is primarily focused on providing novel therapies in oncology, as well as other research areas centered around rare diseases and immune disorders.
SummaryThe purpose of this job is to oversee statistical vendor deliverables, perform programmatic review of analysis datasets and Table, Listing, and Figures (TLFs) generated by vendor, ensure deliverable quality, and expedite the preparation of oncology compound regulatory submission. It will also to maintain institutional knowledge across oncology compounds and support building up oncology programming standard on datasets and TFLs to improve efficiency and quality.

Responsibilities

By leading internal programming contractor or by self, perform programmatic review of analysis datasets and TLFs generated by statistical vendor, ensure deliverable quality for the pivotal studies, Integrated Summary of Efficacy (ISE)/Integrated Summary of Safety (ISS) for oncology submission compounds, and expedite the preparation of regulatory submissions. Responsibilities include: review Case Report Form (CRF) annotation and Study Date Tabulation Model (SDTM) dataset, identify data inconsistencies and support data review, review analysis dataset specifications and ensure correct interpretation of SAP, develop independent programs to validate analysis dataset and TLFs generated by vendor, ensure analysis dataset in compliance with CDISC and submission requirement, review submission data package and ensure its quality and integrity
Oversee statistical programming vendor on project planning and execution to ensure high quality deliverables and timelines met. Responsibilities include: review and agree on vendor project timelines and resource planning, work in tandem with Biostatistics and Data Management members to ensure best vendor performance, monitor analysis dataset and TLFs transfers for ongoing and complete trials, confirm data use and output quality, proactively ensure the resolution of programming related issues prior to database lock analysis, be accountable and verify completeness of study programming deliverables, maintain all required study programming documentation required for Trial Master File (TMF)
Maintain institutional knowledge across oncology compounds and support building up oncology programming standard on datasets and TFLs to improve efficiency and quality. Responsibilities include: contribute to CRF and SDTM standard development, support develop, implement, and maintain Analysis Data Model (ADaM) dataset and TLF standard, develop sample programs to generate standard ADaM dataset and TLFs, support training and ensure implementation of ADaM and TLFs standard in clinical trials analysis
Provide programming support to prepare regulatory requested analyses and help submission team in quick turnaround in response to regulatory agencies. Responsibilities include: create TLFs to support submission QAs in a quick turnaround, support ad-hoc and exploratory analysis requested by clinical team, provide programming supports in agency response or potential Advisory Committee Meeting
Develop and maintain programming macros to effectively support internal data review and monitoring. Responsibilities include: work with Biostatistics member to define the requirements of efficacy data review, develop macros and support the internal data review and monitoring on an ongoing basis
Qualifications: Successful candidates will be able to meet the qualifications below with or without a reasonable accommodation.
Education Qualifications (from an accredited college or university)

Bachelor's Degree from an accredited institution in science or in a technical field required
Master's Degree preferred
Experience Qualifications

7 or more years proven experience within pharmaceutical industry, or CROs supporting statistical analysis of clinical trials programming with Bachelor's degree preferred
4 or more years proven experience within pharmaceutical industry, or CROs supporting statistical analysis of clinical trials programming with Masters degree preferred
Advanced working knowledge of all aspects of the SAS programming language used in clinical trials programming. preferred
Advanced working knowledge of CDISC SDTM and ADaM, and extensive experiences of their implementation in clinical trials analysis preferred
Advanced understanding of statistical concepts in support of analyses and reporting of clinical trials. preferred
Having knowledge of all phases of drug development, including early and late phase clinical development and submission preferred
Having solid background of applied statistics preferred
Solid knowledge of new advanced statistical methods using SAS preferred
Knowledge in database structures and set-up preferred
The candidate should have successfully provided programming expertise at the Project level for at least two global development projects that have been submitted to regulatory agencies preferred
Daiichi Sankyo, Inc. is an equal opportunity/affirmative action employer. Qualified applicants will receive consideration for employment without regard to sex, gender identity, sexual orientation, race, color, religion, national origin, disability, protected veteran status, age, or any other characteristic protected by law.
Start your job application: click Apply Now
Show Less
Report",3.9,"Daiichi Sankyo, Inc.
3.9","Basking Ridge, NJ",#N/A,10000+ Employees,1899,Biotech & Pharmaceuticals,Pharmaceutical & Biotechnology,$5 to $10 billion (USD)
22,#N/A,#N/A,"Location: Lee Health Corporate Center
-
Department: Analytics Center of Excellence
-
Workdays/Nights: Days

4211 Metro Parkway
-
Shift: Shift 1
-
8:00:00 AM to 4:30:00 PM

Fort Myers, FL 33916
-
Work Type: Full Time
-
Exempt: Yes

Job Summary
Summary:

A data scientist's main mission is to collaborate with the business operations team to answer business questions by using data mining techniques, including pattern detection, graph analysis or statistical analysis. This position is an advanced technical professional role responsible for exploring and analyzing data across the enterprise and presenting information and key insights that supports the organization's strategies. Data Model Architecture designs must meet initial needs and allow scalability to support growth. The Data Scientist will have in-depth knowledge across multiple technical environments as well as strong business acumen and can provide expertise regarding systems design, integration and performance analysis across the business. The role promotes shared infrastructure and applications to reduce costs and improve information flows, and it ensures that new technology solutions do not duplicate functionality or diverge from each other and business and IT strategies. This role will interface with the business and IT community to ensure that the right people have access to the right data in the right format at the right time. The Data Scientist will identify and prioritize opportunities for and contribute to the improvement of quality, safety and cost, as well as Patient, Customer, Physician and Employee satisfaction.
Job Requirements
Responsibilities:

Educational Requirements
Required:
Bachelor's degree with a major in Information Systems, Computer Science, Mathematics, Engineering, Statistics or related scientific discipline
Preferred:
Master's Degree or Ph.D in a relevant technical field OR Information Systems certification in a specific supported software package(s)
Experience
Required:
10 years of experience designing, managing, developing and analyzing multiple large complex data models spanning multiple disparate sources
5 years of experience delivering key insights to and serving as trusted advisor to Board of Directors, Executives, Directors and Managers
Preferred:
Experience with business and clinical data in a healthcare setting, especially Epic, Lawson Experience utilizing a formal Quality Management methodology such as Lean, Six Sigma or TQM
State of Florida Licensure Requirements
Not Required

Certifications/Registration Requirements
Not required
US:FL:Fort Myers
Show Less
Report",3.6,"Lee Health
3.6","Fort Myers, FL",#N/A,10000+ Employees,1916,Health Care Services & Hospitals,Healthcare,Unknown / Non-Applicable
23,#N/A,#N/A,"Join a Legacy of Innovation 110 Years and Counting!

Daiichi Sankyo Group is dedicated to the creation and supply of innovative pharmaceutical therapies to improve standards of care and address diversified, unmet medical needs of people globally by leveraging our world-class science and technology. With more than 100 years of scientific expertise and a presence in more than 20 countries, Daiichi Sankyo and its 15,000 employees around the world draw upon a rich legacy of innovation and a robust pipeline of promising new medicines to help people. Under the Group’s 2025 Vision to become a “Global Pharma Innovator with Competitive Advantage in Oncology,” Daiichi Sankyo is primarily focused on providing novel therapies in oncology, as well as other research areas centered around rare diseases and immune disorders.
SummaryThe purpose of this job is to support quality assurance of statistical vendor deliverables, including performing programmatic review of analysis datasets and Table, Listing, and Figures (TLFs) generated by vendor, ensuring deliverable quality, and helping to expedite the preparation of regulatory submission. It will also to support statistical analysis during submissions and post-submission regulatory response period by independently developing and/or validating analysis datasets, and TLFs.

Responsibilities

Perform programmatic review of analysis datasets and TLFs generated by statistical vendor, ensure deliverable quality for the pivotal studies and integrated analysis, and expedite the preparation of regulatory submissions. Responsibilities include: review Case Report Form (CRF) annotation and Study Date Tabulation Model (SDTM) dataset, identify data inconsistencies and support data surveillance, review analysis dataset specifications and ensure correct interpretation of SAP, develop independent programs to validate analysis dataset and TLFs generated by vendor, ensure analysis dataset in compliance with CDISC and submission requirement, review submission data package and ensure its quality and integrity
Provide programming supports for submission and help submission team in quick turnaround in exploratory analysis and response to regulatory agencies. Responsivities include: create analysis dataset (including specifications) and TLFs to prepare submission, respond to agencies’ questions, perform ad-hoc analysis requested by clinical team, provide programming supports in potential Oncology Drug Advisory Committee (ODAC)
Support programming project lead to oversee statistical programming vendor on project planning and execution to ensure high quality deliverables and timelines met. Responsibilities include: review and agree on vendor project timelines and resource planning as the backup of the programming project lead, work in tandem with Biostatistics and Data Management members to ensure best vendor performance, monitor analysis dataset and TLFs transfers for ongoing and complete trials, confirm data use and output quality, proactively ensure the resolution of programming related issues prior to database lock analysis, maintain all required study programming documentation required for Trial Master File (TMF)
Support building up DSI compound specific programming standard on datasets and TFLs to improve efficiency and quality. Responsibilities include: support developing, implement, and maintain Analysis Data Model (ADaM) dataset and TLF standards, develop/validate sample programs to generate standard ADaM dataset and TLFs, and develop and maintain programming macros to effectively support internal data review and data surveillance.
Qualifications: Successful candidates will be able to meet the qualifications below with or without a reasonable accommodation.
Education Qualifications (from an accredited college or university)
Bachelor's Degree an accredited institution in a science or in a technical field required
Experience Qualifications
4 or more years with Bachelor’s degree with (or Master’s degree with minimum 2 years) proven experience within pharmaceutical industry, or CROs supporting statistical analysis of clinical trials programming preferred
Advanced working knowledge of SAS programming language used in clinical trials programming. preferred
Advanced working knowledge of CDISC ADaM, and extensive experiences of their implementation in clinical trials analysis preferred
Working knowledge of CDISC SDTM preferred
Advanced understanding of statistical concepts in support of analyses and reporting of clinical trials. preferred
Knowledge of drug development. preferred
Experience in regulatory submission and support preferred. preferred
Solid background in applied statistics preferred
Solid knowledge of new, advanced statistical methods using SAS and R is a plus preferred
Knowledge in database structures and set-up preferred
Daiichi Sankyo, Inc. is an equal opportunity/affirmative action employer. Qualified applicants will receive consideration for employment without regard to sex, gender identity, sexual orientation, race, color, religion, national origin, disability, protected veteran status, age, or any other characteristic protected by law.
Apply Now: click Apply Now
Show Less
Report",3.9,"Daiichi Sankyo, Inc.
3.9","Basking Ridge, NJ",#N/A,10000+ Employees,1899,Biotech & Pharmaceuticals,Pharmaceutical & Biotechnology,$5 to $10 billion (USD)
24,#N/A,#N/A,"Are you an experienced, passionate pioneer in technology? An industry solutions professional who wants to work in a collaborative environment. As an experienced Data Engineer, you will have the ability to share new ideas and collaborate on projects as a consultant without the extensive demands of travel. If so, consider an opportunity with Deloitte under our Project Delivery Talent Model. Project Delivery Model (PDM) is a talent model that is tailored specifically for long-term, onsite client service delivery. PDM practitioners are local to project locations, minimizing extensive travel, and provides you with a full career path within the firm.

Work you'll do/Responsibilities


Apply rigorous data engineer practices on specific projects
Create algorithms to extract information from large, multiparametric data engineering sets
Be a key contributor to the planning and direction of a project and effectively prioritize goals
Lead discussions at peer review and use quantitative skills to positively influence decision making
Effectively explain technical concepts
Identify opportunities to apply the latest advancements in Machine Learning and Artificial Intelligence to build, test, and validate predictive models
Deploy algorithms to production to identify actionable insights from large databases
Compare results from various methodologies and recommend best techniques to stakeholders
Develop and embed automated processes for predictive model validation, deployment, and implementation
Connect and collaborate with subject matter experts across multiple industries
Make impactful contributions to internal discussions on emerging machine learning methodologies

Data Engineers must also:


Possess strong written and verbal communication skills
Be able to work collaboratively as part of a team
Continuously look for opportunities to learn, build skills, and share learning.


The Team

As a part of the US Strategy & Analytics Offering Portfolio, the AI & Data Operations offering provides managed AI, Intelligent Automation, and Data DevOps services across the advise-implement-operate spectrum.

Qualifications

Required


Bachelor's degree in Computer Science, Information Technology, Computer Engineering, or related IT discipline
4+ years of experience on Data Engineering
5+ years of project management and/or consulting experience
Should have worked on Data Ingesiton, Transformation in on-prem/Cloud solutions
Limited immigration sponsorship may be available
Ability to travel 10%, on average, based on the work you do and the clients and industries/sectors you serve


Preferred Qualifications:


Certifications on either of Cloud platforms (AWS/GCP/Azure)
Healthcare industry experience
Managed teams onshore/offshore
Start your job application: click Apply Now
Show Less
Report",4.0,"Deloitte
4.0","Indianapolis, IN",#N/A,10000+ Employees,1850,Accounting & Tax,Financial Services,$10+ billion (USD)
