,job title,salary estimate,job description,rating,company,location,headquarters,company_size,company_founded,company_industry,company_sector,company_revenue
0,#N/A,#N/A,"Requisition ID: R10046910
Category: Research and Sciences
Location: Melbourne, Florida, United States of America
Citizenship Required: United States Citizenship
Clearance Type: SAP
Telecommute: No- Teleworking not available for this position
Shift: 1st Shift (United States of America)
Travel Required: Yes, 10% of the Time
Positions Available: 2

At Northrop Grumman, our employees have incredible opportunities to work on revolutionary systems that impact people's lives around the world today, and for generations to come. Our pioneering and inventive spirit has enabled us to be at the forefront of many technological advancements in our nation's history - from the first flight across the Atlantic Ocean, to stealth bombers, to landing on the moon. We look for people who have bold new ideas, courage and a pioneering spirit to join forces to invent the future, and have fun along the way. Our culture thrives on intellectual curiosity, cognitive diversity and bringing your whole self to work — and we have an insatiable drive to do what others think is impossible. Our employees are not only part of history, they're making history.

Are you motivated to work in an environment that will challenge you, force you to continuously innovate, and work on solutions that make a difference for your customers? Northrop Grumman Aeronautic Systems relies on our team to provide the insights needed to drive performance across a broad range of strategic activities. We are looking for a passionate Web Developer/Data Engineer to design and develop Front-End applications for automated, end-to-end, ETL pipelines and Data Analytics/Visualization solutions from disparate data sources.
You will share in the ownership of the technical vision and direction for advanced analytics systems that change the way we see and use data. We are looking for people who are self-motivated, hardworking, and have demonstrated the ability to find innovative solutions to complex technical problems.
Support, design, develop, and maintain a scalable ETL pipeline
Data preparation/cleaning, integration, and automation from heterogeneous sources
Design, develop, and maintain the front-end web applications of a scalable Analytics System
Create website layout/user interfaces using standard HTML/CSS practices
Ensure data integrity and system availability
Identify, evaluate, and recommend core technologies and strategies
Monitor and optimize system performance
Decomposition of user requirements into logical functions/components
This requisition may be filled at either a Data Scientist or a Principal Data Scientist based on the qualifications listed below.
Basic Qualifications Data Scientist (Level 2):
Bachelor’s degree in a Science, Technology, Engineering, or Mathematics (STEM) field with 2+ years of experience
2+ years of experience working with ETL techniques and frameworks
Knowledgeable of Web Application Development techniques and frameworks
Experience with Microsoft SQL Server
Experience with data preparation/cleansing
Experience with a scripting language, preferably Python
Solid understanding of modern HTML/CSS
Familiarity with JavaScript, Flask/Django and/or Bootstrap
Understanding of Agile Software Development
Experience with version control software such as Git and TortoiseSVN
Ability to obtain and maintain a DoD Secret Security Clearance AND Special Program Access in a reasonable amount of time as determined by business needs
Basic Qualifications Principal Data Scientist (Level 3):
Bachelor’s degree in a Science, Technology, Engineering, or Mathematics (STEM) field with 5+ years of experience or a Master’s in STEM and 3+ years’ experience
2+ years of experience working with ETL techniques and frameworks
Knowledgeable of Web Application Development techniques and frameworks
Experience with Microsoft SQL Server
Experience with data preparation/cleansing
Experience with a scripting language, preferably Python
Solid understanding of modern HTML/CSS
Familiarity with JavaScript, Flask/Django and/or Bootstrap
Understanding of Agile Software Development
Experience with version control software such as Git and TortoiseSVN
Ability to obtain and maintain a DoD Secret Security Clearance AND Special Program Access in a reasonable amount of time as determined by business needs
Preferred Qualifications:
Master’s degree in a STEM field with 3+ years of relevant experience
Special Program Access
3+ years of experience working with ETL and web development techniques and frameworks
Proficiency in Python, C#, SQL, SSIS, and data visualization tools
Experience developing web applications supported across multiple browsers (e.g. IE11, Edge, Chrome, Firefox)
Experience in responsive UI/UX design
Proficiency in HTML/CSS, JavaScript, Flask, and other Front-End Technologies
Experience with profiling/debugging
Experience with web analytics and load testing software (e.g. Matomo)
Experience with load testing software (e.g. Locust)
Experience with Atlassian Suite (JIRA, Bitbucket, Confluence)
Active DoD SCI Clearance
""

Salary Range: $78,300 USD - $117,500 USD
Salary Range 2: $96,400 USD - $144,600 USD


Employees may be eligible for a discretionary bonus in addition to base pay. Annual bonuses are designed to reward individual contributions as well as allow employees to share in company results. Employees in Vice President or Director positions may be eligible for Long Term Incentives. In addition, Northrop Grumman provides a variety of benefits including health insurance coverage, life and disability insurance, savings plan, Company paid holidays and paid time off (PTO) for vacation and/or personal business.

The health and safety of our employees and their families is a top priority. The company encourages employees to remain up-to-date on their COVID-19 vaccinations. U.S. Northrop Grumman employees may be required, in the future, to be vaccinated or have an approved disability/medical or religious accommodation, pursuant to future court decisions and/or government action on the currently stayed federal contractor vaccine mandate under Executive Order 14042 https://www.saferfederalworkforce.gov/contractors/.
Northrop Grumman is committed to hiring and retaining a diverse workforce. We are proud to be an Equal Opportunity/Affirmative Action Employer, making decisions without regard to race, color, religion, creed, sex, sexual orientation, gender identity, marital status, national origin, age, veteran status, disability, or any other protected class. For our complete EEO/AA and Pay Transparency statement, please visit http://www.northropgrumman.com/EEO. U.S. Citizenship is required for most positions.
To apply to this job, click Apply Now
Show Less
Report",4.0,"Northrop Grumman
4.0","Melbourne, FL",#N/A,10000+ Employees,1939,Aerospace & Defense,Aerospace & Defense,$10+ billion (USD)
1,#N/A,#N/A,"Overview:
Oasis Systems has an exciting opportunity for a SE-3 Data Link Scientist/Engineer at the 46 Test Squadron at Eglin AFB, FL. We are seeking a candidates who possesses a background in radio frequency (RF), secure, tactical data link communications.

LOCATION: Eglin AFB, FL
JOB STATUS: Full Time
TRAVEL: 20% CONUS / OCONUS TDYs

REQUIRED QUALIFICATIONS (Education, Certifications, Experience, Skills)
SECURITY CLEARANCE: Active Secret clearance and U.S. Citizenship is required for all applicants
EDUCATION: Bachelor’s or Master’s Degree in a technical discipline
CERTIFICATIONS: N/A
EXPERIENCE LEVEL: 3-10 years

OTHER QUALIFICATIONS/SKILLS:
Bachelor of Science in Electrical Engineering, Mathematics or related technical field (EE, ME, or AE). Three to ten (3-10) years of experience may be substituted for degree requirements.
Possess and be able to maintain an active DOD Secret security clearance.
Three to ten (3-10) years of technical experience with Fourth Generation (Link 16) radios and tactical data links messages & associated military standards relative to C4ISR.
Must be capable of traveling to contractors' facilities, test sites, and other locations, both CONUS and OCONUS.
Proficiency in the use and integration of MS Office applications.
Effective oral and written communications skills.

PREFERRED SKILLS:
Relevant technical experience in areas related to tactical data links, data link radios, radio frequency waves and propagation, computer networks.
Experience with fourth (Link 16) and fifth (MADL, IFDL) generation tactical data links interoperability testing, implementation and operations.
An understanding of developmental test and evaluation processes, specifically - acquisition program development and detailed knowledge of Air Force Command and Control (C2) test methodologies including AFI 99-103.
Top Secret security clearance.

RESPONSIBILITIES:
Perform as a member of the Air Force’s premiere tactical data link developmental test team
Be a test team lead engineer responsible for planning, developing, executing data link test operations and reporting test findings.
Conduct data analysis and apply knowledge of engineering technology.
Coordinate data link equipment integration on military ground and airborne platforms.
Directly support System Program Offices, other DOD services, Joint Battle Labs, as well as development contractors.
Develop and review test architectures for the system under test and coordinate test assets, support assets, and data collection device availability to ensure successful test events.
Write and review data link test plans, reports, and procedures.
Support data analysis working groups to measure system performance and conduct root cause analysis.
Conduct technical research, testing, and reporting of emerging technological systems affecting the performance of all data link test programs.
Analyze post test results in a timely fashion so as to meet final test reporting timeliness.
Mentor junior engineers.
Identify areas for improvement and recommend technical solutions required to meet assigned tasks.
Travel to TDY locations to support test events, program management events, or training efforts.

Who We Are
Oasis Systems is a premier provider of customer-driven, cost-effective, and quality Engineering Services; Enterprise Systems and Applications; Human Factors Engineering; Information Technology and Cyber Security; Professional Services; and Specialized Engineering Solutions to the Department of Defense, Federal Aviation Administration, Nuclear Regulatory Commission, and other Federal Agencies.

We strive to be an exciting and welcoming company that attracts, develops, motivates and retains the most talented, skilled and dedicated people in the industry; where they are encouraged to achieve personal excellence, purpose, and their full potential and career aspirations, while supporting mission-critical national security technologies and programs.

Oasis Systems is an equal opportunity employer and does not discriminate in hiring or employment on the basis of any legally protected characteristic including, but not limited to, race, color, religion, national origin, marital status, gender, sexual orientation, ancestry, age, medical condition, military veteran status or on the basis of physical handicap which, with reasonable accommodation, render the application to satisfactorily perform the job available
Show Less
Report",4.5,"Oasis Systems LLC
4.5","Shalimar, FL",#N/A,1001 to 5000 Employees,1997,Aerospace & Defense,Aerospace & Defense,$100 to $500 million (USD)
2,#N/A,#N/A,"The Senior Blockchain Analyst for the Blockchain Lab will lead projects related to the Lab's initiatives and related collaboration efforts with both internal and external stakeholders. Responsibilities for this position include leading the development of the strategy and structure for: analyzing data from blockchain network nodes or market sources, exploring the development of new regulatory tools, and on-boarding blockchain vendor capabilities. The Senior Blockchain Analyst will provide thought leadership and, under the direction of the Senior Director, guide the efforts of the research team and closely partner with other teams within FINRA to provide training and strengthen oversight capabilities across the organization on areas related to blockchain technology.
Essential Job Functions:
Lead efforts to design, test, and operate new regulatory tools.
Lead research on crypto projects or market developments and communicate to internal and external stakeholders through various forums and media.
Serve as an expert on blockchain vendor capabilities and manage process of selecting and on-boarding of platforms beneficial to FINRA.
Lead the formation of analysis, written summaries, presentations and commentary designed to inform decision makers of information pertaining blockchain technology and related regulatory impact.
Serve as an expert on market developments related to blockchain technology and as resource for both internal and external constituents.
Query, analyze, visualize data ingested from blockchain networks or market sources as part of POC, bespoke or ongoing projects.
Provide crypto-asset training to FINRA teams to deepen expertise across the organization.
Represent FINRA in external forums.
Other Responsibilities:
Other duties as assigned.
Education/Experience Requirements:
BS/BA in a related field is required; Graduate degree [MBA or Professional degree] preferred. Preferably in Business, Finance, Economics, Applied Math or related fields with some quantitative training.
Minimum of at least 7 years of relevant experience.
Experience conducting and developing the structure for research into crypto projects, protocols, market developments.
Experience in overseeing or leading a technical project, program and/or practice area.
Experience in overseeing or leading efforts to develop structure and strategy for data analysis and modeling, creation of dashboards or other visualization methods.
Experience collaborating across business teams and optimize tasks to create business value.
Self-motivated and entrepreneurial individual that can work in an experimental setting.
Excellent interpersonal communication, writing and presentation skills, including facility with PowerPoint.
Expertise in blockchain market including knowledge of on and off-chain platforms for issuing and trading of crypto assets.
Preferred Experience:
Knowledge of crypto analytics tools a plus, for example for forensic analysis or market surveillance.
Experience with SQL a plus.
Working Conditions:
Will work in a hybrid environment both office and remote.
The salary for this position if the work is performed in New York, New York is a minimum of annually $143,200 to a maximum of $277,800 annually actual compensation is based on various factors, including but not limited to, the candidate’s skill set, level of experience, education and internal peer compensation comparisons.
#LI-Hybrid
To be considered for this position, please submit an application.
The information provided above has been designed to indicate the general nature and level of work of the position. It is not a comprehensive inventory of all duties, responsibilities and qualifications required.
Please note: If the “Apply Now” button on a job board posting does not take you directly to the FINRA Careers site, enter www.finra.org/careers into your browser to reach our site directly.
FINRA strives to make our career site accessible to all users. If you need a disability-related accommodation for completing the application process, please contact FINRA’s accommodation help line at 240.386.4865. Please note that this number is exclusively for inquiries regarding application accommodations.
Employees may be eligible for a discretionary bonus in addition to base pay. FINRA also provides a variety of benefits including comprehensive health and welfare benefits, life and disability insurance, paid holidays, vacation, personal, and sick leave. FINRA offers immediate participation and vesting in a 401(k) plan with company match. You will also be eligible for participation in an additional FINRA-funded retirement contribution, our tuition reimbursement program and many other benefits. If you would like to contribute to our important mission and work collegially in a professional organization that values intelligence, integrity and initiative, consider a career with FINRA.
Important Information
FINRA’s Code of Conduct imposes restrictions on employees’ investments and requires financial disclosures that are uniquely related to our role as a securities regulator. FINRA employees are required to disclose to FINRA all brokerage accounts that they maintain, and those in which they control trading or have a financial interest (including any trust account of which they are a trustee or beneficiary and all accounts of a spouse, domestic partner or minor child who lives with the employee) and to authorize their broker-dealers to provide FINRA with duplicate statements for all of those accounts. All of those accounts are subject to the Code’s investment and securities account restrictions, and new employees must comply with those investment restrictions—including disposing of any security issued by a company on FINRA’s Prohibited Company List or obtaining a written waiver from their Executive Vice President—by the date they begin employment with FINRA. Employees may only maintain securities accounts that must be disclosed to FINRA at one or more securities firms that provide an electronic feed (e-feed) of data to FINRA, and must move securities accounts from other securities firms to a firm that provides an e-feed within three months of beginning employment.

As standard practice, employees must also execute FINRA’s Employee Confidentiality and Invention Assignment Agreement without qualification or modification and comply with the company’s policy on nepotism.
Search Firm Representatives
Please be advised that FINRA is not seeking assistance or accepting unsolicited resumes from search firms for this employment opportunity. Regardless of past practice, a valid written agreement and task order must be in place before any resumes are submitted to FINRA. All resumes submitted by search firms to any employee at FINRA without a valid written agreement and task order in place will be deemed the sole property of FINRA and no fee will be paid in the event that person is hired by FINRA.
FINRA is an Equal Opportunity and Affirmative Action Employer
All qualified applicants will receive consideration for employment without regard to age, citizenship status, color, disability, marital status, national origin, race, religion, sex, sexual orientation, gender identity, veteran status or any other classification protected by federal state or local laws as appropriate, or upon the protected status of the person’s relatives, friends or associates.
FINRA abides by the requirements of 41 CFR 60-741.5(a). This regulation prohibits discrimination against qualified individuals on the basis of disability, and requires affirmative action by covered prime contractors and subcontractors to employ and advance in employment qualified individuals with disabilities.
FINRA abides by the requirements of 41 CFR 60-300.5(a). This regulation prohibits discrimination against qualified protected veterans, and requires affirmative action by covered prime contractors and subcontractors to employ and advance in employment qualified protected veterans.
Apply Now: click Apply Now
Show Less
Report",4.1,"Finra
4.1","Washington, DC",#N/A,1001 to 5000 Employees,2007,Investment & Asset Management,Financial Services,Unknown / Non-Applicable
3,#N/A,#N/A,"What is Bloomberg Enterprise Data?
We are Bloomberg Enterprise Data - fast paced, innovative and expanding! We partner closely with our clients, taking time to understand their unique businesses and individual data and financial technology (FinTech) needs. Our endless selection of datasets, covering all asset types, with multiple delivery technologies and flexible scheduling enables our clients to get exactly the data they need, when they need it, in the format they prefer. Put simply, our award-winning data powers the capital markets.

The Role:
The Enterprise Data Machine Learning Quant Researcher will develop new machine learning methodologies and new state of art models that are applicable to real world financial problems.

We'll trust you to:
Conduct statistical analysis, develop machine learning methodologies, model estimation and overseeing part of the research activities
Explore current academia and market best practices in machine learning approaches
Assess quality controls around different approaches as well as suggest new approaches in research
Write quality ML research papers potentially published on top ML conferences/journals
Work cross functionally with Product Managers, Senior Leaders in Enterprise Data, Engineering, and other Quant Research teams
You'll need to have:
Master's degree in an applied numerical field: Physics, Mathematics, Statistics, Computer Science, Operations Research, etc.
Quantitative analysis, programming, and statistical modeling skills
Experience in Python and familiarity with distributed computing frameworks (e.g. Spark)
Attention to data integrity and robustness of various models, and a detailed scientific/statistical approach
Experience in independent research and writing research papers
Understanding of different machine learning techniques: dimensionality reduction, representation learning, generative modeling, transfer learning, and missing value imputation, recommender system, causal inference
We'd love to see:
Financial industry experience
Publications on top machine learning conferences/journals


Does this sound like you?
Apply if you think we're a good match and we'll get in touch with you to let you know next steps. In the meantime, check out http://www.bloomberg.com/professional. Enterprise Data page: https://data.bloomberg.com/

Bloomberg is an equal opportunity employer and we value diversity at our company. We do not discriminate on the basis of age, ancestry, color, gender identity or expression, genetic predisposition or carrier status, marital status, national or ethnic origin, race, religion or belief, sex, sexual orientation, sexual and other reproductive health decisions, parental or caring status, physical or mental disability, pregnancy or maternity/parental leave, protected veteran status, status as a victim of domestic violence, or any other classification protected by applicable law.
Bloomberg is a disability inclusive employer. Please let us know if you require any reasonable adjustments to be made for the recruitment process. If you would prefer to discuss this confidentially, please email amer_recruit@bloomberg.net.




Salary Range: 160,000 - 250,000 USD Annually + Benefits + Bonus

The referenced salary range is based on the Company's good faith belief at the time of posting. Actual compensation may vary based on factors such as geographic location, work experience, market conditions, education/training and skill level.

We offer one of the most comprehensive and generous benefits plans available and offer a range of total rewards that may include merit increases, incentive compensation [Exempt roles only], paid holidays, paid time off, medical, dental, vision, short and long term disability benefits, 401(k) +match, life insurance, and various wellness programs, among others. The Company does not provide benefits directly to contingent workers/contractors and interns.
Start your job application: click Apply Now
Show Less
Report",4.1,"Bloomberg
4.1","New York, NY",#N/A,10000+ Employees,1981,Computer Hardware Development,Information Technology,Unknown / Non-Applicable
