,job title,salary estimate,job description,rating,company,location,headquarters,company_size,company_founded,company_industry,company_sector,company_revenue
8,#N/A,#N/A,"Overview:
Oasis Systems has an exciting opportunity for a Senior Python Data Scientist to support the Commodity Futures Trading Commission (CFTC) in Washington, DC. The contractor shall provide support in data analytics (including descriptive and predictive analytics and data mining), large data manipulation, data visualization, and the use of data analytic tools. Activities that the contractor may be tasked to perform include gathering requirements from stakeholders, conducting financial data analysis in a Big Data environment, and creating reports and documentation.

LOCATION: Washington, DC
JOB STATUS: Full-Time
TRAVEL: N/A
REQUIRED QUALIFICATIONS (Education, Certifications, Experience, Skills)
SECURITY CLEARANCE: Ability to pass a Special Agreement Check (SAC) and a National Agency Check and Inquiries (NACI) Background Investigation and U.S. Citizenship is required for all applicants.
EDUCATION: Bachelor’s degree
CERTIFICATIONS AND TOOLS: Experience developing data-driven applications in Python and/or other data management tools. Highly experienced with data manipulation and transformation. Experience in Finance is a plus.
EXPERIENCE LEVEL: A total minimum of 8 years of relevant experience in data application development, data analysis, and data management, with 5 years specifically in Python data manipulation and transformation.

RESPONSIBILITIES:
Functionally, the candidate will be responsible for:
Independently designing data applications based on existing requirements and handling all aspects of the software development lifecycle, with a specific focus on data quality and validation.
Designing and developing reports leveraging a variety of business intelligence software, with a specific focus on Python visualization libraries and data visualization tools such as MicroStrategy and QuickSight.
Performing ad hoc data analysis, including financial modeling and Machine Learning.
Conducting performance tuning and troubleshooting on existing data analytics applications.
Working closely with the customer to gather and document project requirements specific to data-driven applications and the manipulation of data for presentation and/or testing.
Creating documentation as required under the Project Management Life Cycle and the Configuration Change Board (CCB) in order to move projects to the production environment.
Participating in facilitated meetings between stakeholders at CFTC, which may include regular status meetings, user acceptance testing meetings, and ad hoc development discussions.

Who We Are
Oasis Systems is a premier provider of customer-driven, cost-effective and quality Engineering Services; Enterprise Systems and Applications; Human Factors Engineering; Information Technology and Cyber Security; Professional Services; and Specialized Engineering Solutions to the Department of Defense, FAA, NRC and other federal agencies.

We strive to be an exciting and welcoming company that attracts, develops, motivates and retains the most talented, skilled and dedicated people in the industry; where they are encouraged to achieve personal excellence, purpose, and their full potential and career aspirations; while supporting mission-critical national security technologies and programs.

Oasis Systems is an equal opportunity employer and does not discriminate in hiring or employment on the basis of any legally protected characteristic including, but not limited to, race, color, religion, national origin, marital status, gender, sexual orientation, ancestry, age, medical condition, military veteran status or on the basis of physical handicap which, with reasonable accommodation, render the application to satisfactorily perform the job available.
Show Less
Report",4.5,"Oasis Systems LLC
4.5","Washington, DC",#N/A,1001 to 5000 Employees,1997,Aerospace & Defense,Aerospace & Defense,$100 to $500 million (USD)
9,#N/A,#N/A,"Data science at the National Security Agency (NSA) is a multi-disciplinary field that uses elements of mathematics, statistics, computer science, and application-specific knowledge to gather, make, and communicate principled conclusions from data. Data science is present in every aspect of the mission. NSA Data Scientists tackle challenging real-world problems leveraging big data, high-performance computing, machine learning, and a breadth of other methodologies. We are looking for critical thinkers, problem solvers, and motivated individuals who are enthusiastic about data and believe that answers to hard questions lie in the yet-to-be-told story of diverse, complicated data sets. You will employ your mathematical science, computer science, and quantitative analysis skills to develop solutions to complex data problems and take full advantage of NSA's capabilities to tackle the highest priority foreign intelligence and cybersecurity challenges. As a Data Scientist, your responsibilities may include: - Exploratory data analysis and exploratory model-fitting to reveal data features of interest - Machine-learned predictive modeling - Construct usable data sets from multiple sources to meet customer needs - Identifying and analyzing anomalous data (including metadata) - Developing conceptual design and models to address mission requirements - Developing qualitative and quantitative methods for characterizing datasets in various states. - Performing analytic modeling, scripting, and/or programming - Working collaboratively and iteratively throughout the data-science lifecycle - Designing and developing analytics and techniques for analysis - Analyzing data using mathematical and statistical methods - Evaluating, documenting, and communicating research processes, analyses, and results to customers, peers, and leadership - Creating interpretable visualizations.
Job Summary
Data scientists are hired into positions either directly supporting a technical mission office or into the Data Science Development Program (DSDP). For the former, you will have the opportunity to collaborate with NSA's experts in the field of data science and other computational disciplines while tackling NSA's highest priority mission challenges. You will have opportunities to attend technical conferences with experts internally and from industry and academia as well as discuss and share NSA's challenges and successes at technical roundtables. The Data Science Development Program (DSDP) is a three-year opportunity to develop and enhance your data science skills. Participants experience the breadth of data science at NSA through six- to nine-month assignments in a variety of diverse organizations, and collaborate with NSA's experts in the field of data science. You will have opportunities to attend technical conferences with experts from industry and academia, and you will routinely discuss and share NSA's challenges and successes at weekly technical roundtables. You will study data science and related subjects taught by NSA experts. We foster an environment where you will develop your data science skills, while quickly contributing to NSA's highest priority mission challenges. Graduates of the DSDP may choose their first permanent assignments from any of the NSA Directorates.
Qualifications
The qualifications listed are the minimum acceptable to be considered for the position. Applicants who meet minimum qualifications may be asked to complete the Data Science Examination (DSE) evaluating their knowledge of statistics, mathematics, and computer science topics that pertain to data science work. Passing this examination is a requirement in order to be considered for selection into a data scientist position. Degree must be in Mathematics, Applied Mathematics, Statistics, Applied Statistics, Machine Learning, Data Science, Operations Research, or Computer Science. A degree in a related field (e.g., Computer Information Systems, Engineering), a degree in the physical/hard sciences (e.g. physics, chemistry, biology, astronomy), or other science disciplines (i.e., behavioral, social, library, and life) may be considered if it includes a concentration of coursework (typically 5 or more courses) in advanced mathematics (typically 200 level or higher; such as calculus, differential equations, discrete mathematics, linear algebra, and calculus based statistics) and/or computer science (e.g., algorithms, programming, data structures, data mining, artificial intelligence). College-level Algebra or other math courses intended to meet a basic college level requirement, or upper level math courses designated as elementary or basic do not count. Note: Degrees in related fields will be considered if accompanied by a Certificate in Data Science from an accredited college/university. ENTRY/DEVELOPMENTAL Entry is with a Bachelor's degree and no experience. An Associate's degree plus 2 years of relevant experience may be considered for individuals with in-depth experience that is clearly related to the position. Relevant experience must be in one or more of the following: designing/implementing machine learning, data mining, advanced analytical algorithms, programming, data science, advanced statistical analysis, artificial intelligence, computational science, software engineering, or data engineering.
FULL PERFORMANCE Entry is with a Bachelor's degree plus 3 years of relevant experience or a Master's degree plus 1 year of relevant experience or a Doctoral degree and no experience. An Associate's degree plus 5 years of relevant experience may be considered for individuals with in-depth experience that is clearly related to the position. Relevant experience must be in two or more of the following: designing/implementing machine learning, data mining, advanced analytical algorithms, programming, data science, advanced statistical analysis, artificial intelligence, computational science, software engineering, or data engineering.
SENIOR Entry is with a Bachelor's degree plus 6 years of relevant experience or a Master's degree plus 4 years of relevant experience or a Doctoral degree plus 2 years of relevant experience. An Associate's degree plus 8 years of relevant experience may be considered for individuals with in-depth experience that is clearly related to the position. Relevant experience must be in two or more of the following: designing/implementing machine learning, data mining, advanced analytical algorithms, programming, data science, advanced statistical analysis, artificial intelligence, computational science, software engineering, or data engineering.
EXPERT Entry is with a Bachelor's degree plus 9 years of relevant experience or a Master's degree plus 7 years of relevant experience or a Doctoral degree plus 5 years of relevant experience. An Associate's degree plus 11 years of relevant experience may be considered for individuals with in-depth experience that is clearly related to the position. Relevant experience must be in two or more of the following: designing/implementing machine learning, data mining, advanced analytical algorithms, programming, data science, advanced statistical analysis, artificial intelligence, computational science, software engineering, or data engineering.
Competencies
The ideal candidate is someone with a desire for continual learning and strong problem-solving, analytical, and interpersonal skills. You might be a great fit for our team if the following describes you: - Completed a degree program in the fields of mathematics, statistics, computer science, computational sciences, or a passion for rigorous analysis of data - Tenacity, integrity, persistence, and willingness to learn - Ability to solve complex problems - Use critical thinking and reasoning to make analytic determinations - Works effectively in a collaborative environment - Strong communications skills to both technical and non-technical audiences
Pay, Benefits, & Work Schedule
Salary offers are based on candidates' education level and years of experience relevant to the position and also take into account information provided by the hiring manager/organization regarding the work level for the position. This is a full-time position. This position is hiring for the Maryland location. Salary ranges vary by work level. Salary range: $74,682 - $176,300 (Entry/Full Performance/Senior/Expert) On the job training, internal NSA courses, and external training will be made available based on the need and experience of the selectee. Monday - Friday, with basic 8 hr/day requirements between 0600 to 1800 (flexible).
How to apply
U.S. Citizenship is required for all applicants. NSA is an equal opportunity employer and abides by applicable employment laws and regulations. All applicants and employees are subject to random drug testing in accordance with Executive Order 12564. Employment is contingent upon successful completion of a security background investigation and polygraph. Due to time sensitive communications regarding your application, please ensure your spam filters are configured to accept email from noreply@intelligencecareers.gov. Please review the job posting thoroughly to ensure you meet the described qualifications and are aware of all associated requirements. To apply for this position, please click the 'Apply' button located at the top right of this posting. After completing the application for the first time, or reviewing previously entered information, and clicking the 'Submit' button, you will receive a confirmation email. We encourage you to apply as soon as possible, as job postings could close earlier than the closing date due to sufficient number of applicants, or the position is no longer available. You may be asked a series of questions depending on the position you apply for. Your responses will be used as part of the application screening process and will assist in determining your eligibility for the position. Be sure to showcase within your resume those experiences relevant to this position. Failure to provide the required information or providing inaccurate information will result in your application not being considered for this position. Only those applicants who meet all position qualifications, may be contacted to begin employment processing. Please remain diligent in monitoring email and your SPAM folder. Reasonable accommodations may be provided to applicants with disabilities during the application and hiring process where appropriate. Please visit our Diversity link for more information. This position is a Defense Civilian Intelligence Personnel System (DCIPS) position in the Excepted Service under 10 U.S.C. 1601. DoD Components with DCIPS positions apply Veterans' Preference to eligible candidates as defined by Section 2108 of Title 5 USC, in accordance with the procedures provided in DoD Instruction 1400.25, Volume 2005, DCIPS Employment and Placement. If you are a veteran claiming veterans' preference, as defined by Section 2108 of Title 5 U.S.C., you may be asked to submit documents verifying your eligibility.
DCIPS Disclaimer
The National Security Agency (NSA) is part of the DoD Intelligence Community Defense Civilian Intelligence Personnel System (DCIPS). All positions in the NSA are in the Excepted Services under 10 United States Codes (USC) 1601 appointment authority.
Apply Now: click Apply Now
Show Less
Report",3.5,"National Security Agency
3.5","Fort Meade, MD",#N/A,Unknown,#N/A,National Agencies,Government & Public Administration,Unknown / Non-Applicable
10,#N/A,#N/A,"This individual contributor position will be a member of a high-performing technology team that leads the firm in data services and data science by producing innovative solutions driven by exploratory data analysis from complex and high-dimensional datasets. Specifically, this position will be utilizing advanced analytics, statistics and advanced mathematics, data science and machine learning, programming, data modeling and simulation to identify opportunities, pose business questions and make valuable discoveries that give our business and products a competitive advantage. It includes understanding and managing the data, how it interconnects, and architecting data for self-serve BI and BA opportunities. This position is for a candidate who is business savvy and an expert in data analytics/data science and enjoys framing a problem, shaping and creating solutions, and helping to champion implementation.
PRIMARY DUTIES AND RESPONSIBILITIES
Identify and prioritize business use cases. Understand the business and strategy and work with business leaders to identify and prioritize problems that advanced analytics are suited to solve and effectively communicate these ideas to senior management (i.e., translate business problems into advanced analytics/data science projects and lead in quantifying the various types of risk and rewards that allow these projects to be prioritized).
Thought partner to stakeholders by understanding the business needs through a deep knowledge of business operations, the key strategic objectives of our stakeholders, and what stakeholders need to achieve those strategic objectives. Seen by the stakeholder as an extension of their team and brought in for strategic and operational conversations.
Operationalize data and analytic products while also making sure they continue to deliver value. Be able to tell the story of how data and analytics are positively impacting stakeholders. Work closely with the business to achieve real value through informed decisions and improved actions.
Give direction and insight on all data analytics large initiatives/epics/areas of focus.
Build end-to-end advanced analytics. Work with vast amounts of data from multiple sources to develop/refine/improve predictive models using advanced Python, NLP, ML, AI, IDP and statistical analysis methods such as classification, time-series analysis, regression, statistical inference and recommendation systems.
Collect and prepare data. Help identify the business data needed to produce the most useful insights and future analytics, including business lines and possible outside sources of data. Ensure alignment on short-term delivery goals and long-term data and analytic roadmaps with clear articulation of expected value and how the work is to be prioritized.
Validate business implications. Synthesize analytics-derived insights into easy-to-understand, actionable recommendations that business users can easily understand. Ensure that the insights generated through sophisticated analytics translate to help drive revenue and cost-effective scaling.
Stay abreast of the latest developments and advancements and how they could impact the firm regarding classification models, recommendation engines or natural language processing.
EDUCATION AND EXPERIENCE REQUIREMENTS
Bachelor’s degree in business, IT, mathematics, statistics or relevant degree program.
Preferred Experience: 10+ years in data analytics, 3+ years in DS AI and ML development.
Expertise in solution design, problem framing, design thinking, analytics techniques and building solutions.
Skilled at communicating with a variety of methods including written business cases, data visualizations and infographics.
Demonstrated technical excellence in BI, reporting and analytics tools, analytic solutions (e.g. Power BI, Tableau, R), data visualization, data analytics processing, Python, SQL, AI, and ML.
Experience with the techniques and technologies of data science, along with a comprehensive understanding of the challenges associated with each (e.g., overfitting, model refresh, the challenge of acquiring training data, cost of computing, etc.).
Demonstrated communication and influencing skills with business and technical leaders. A talent for boiling complex ideas down to clear, practical choices. Track record of delivering multiple projects with tangible impact.
Extensive experience leading large complex projects, including strategic and tactical planning and implementation, analysis, design, technology selection and deployment.
Results-driven, the ideal candidate sets aggressive goals and is accountable for continuously driving improved outcomes, leading change and ensuring high standards.
Storytelling: communicates complex ideas in a way that is digestible to a broad audience and leads to decision and action.
Track record of developing and implementing innovative, highly-available, scalable and secure enterprise data and analytic deployments to meet current and future business needs.
Expertise in statistical learning, such as supervised, unsupervised, and weakly supervised learning, particularly in NLP contexts.
Expertise in Python programming, regular expressions, version control, standard Python packages (e.g., pandas, NumPy, Matplotlib), and at least one machine learning framework (e.g., PyTorch, TensorFlow, Scikit-Learn).
Experience with deploying and productionizing machine learning models on cloud or high-performance computing environments (e.g., AWS, Azure) and using CI/CD frameworks.
Expertise with Agile.
Expertise in implementing ML best practices for the entire Data Science lifecycle.
Proficiency with Machine Learning concepts and modeling techniques to solve problems such as clustering, classification, regression, neural networks, anomaly detection, simulation and optimization problems on large-scale data sets and their real-world advantages/drawbacks.
Experience with health care industry data, including hospital quality scores, claims data, medical coding, EMR, billing and reimbursement data in addition to compensation data is preferred.
BEHAVIORAL ATTRIBUTES
Passionate about helping organizations drive their success utilizing data.
Skilled storyteller with a passion for data, you will analyze and evaluate data to create innovative advanced analytics to provide the business with a competitive edge.
Inquisitive with a desire to ask questions and get a deeper understanding of issues (e.g., business and data).
Innovative with the ability to imagine new analytical solutions to any problem.
Confident, with the ability to challenge perceptions and biases of individuals at every level of the organization to enact improvements.
Ability to communicate with both technical and non-technical people. Passionate about helping others grasp and understand technical concepts using accessible language.
Business-oriented, with a solid understanding of business requirements and jargon.
Adjusts communication style and approach based on the intended audience (i.e., highly detailed where and when needed, but also able to be concise).
Intellectual curiosity, with the desire to stay abreast of current and upcoming technologies and tools.
Strongly self-motivated with a keen eye for detail. A natural desire to learn and innovate with like-minded colleagues.
Action-oriented, with the ability to deliver outstanding results through task prioritization and time management.
Applicants for employment must have work authorization that does not now or in the future require sponsorship of a visa for employment authorization in the United States (i.e., H1-B visa, F-1 visa (OPT), TN visa or any other non-immigrant status).
SullivanCotter is an Equal Opportunity Employer/Affirmative Action employer, and all qualified applicants will receive consideration for employment without regard to race, color, religion, sex, age, national origin, protected veteran status, disability status, sexual orientation, gender identity or expression, marital status, genetic information, or any other characteristic protected by law or marital status.
Start your job application: click Apply Now
Show Less
Report",4.0,"SullivanCotter
4.0","Minneapolis, MN",#N/A,201 to 500 Employees,1992,Business Consulting,Management & Consulting,Unknown / Non-Applicable
