,job title,salary estimate,job description,rating,company,location,headquarters,company_size,company_founded,company_industry,company_sector,company_revenue
16,#N/A,#N/A,"At American Family Insurance, we believe people are an organization’s most valuable asset, and their ideas and experiences matter. From our CEO to our agency force, we’re committed to growing a diverse and inclusive culture that empowers innovation that will inspire, protect, and restore our customers’ dreams in ways never imagined.

American Family Insurance is driven by our customers and employees. That’s why we provide more than just a job – we provide opportunity. Whether you’re already part of our team in search of a new challenge or new to our company and ready for what’s next, you’re in the right place. Every dream is a journey that starts with a single step. Start your journey right here. Join our team. Bring your dreams.
Job ID:
R30282 Data Scientist (w/ insurance experience) (Hybrid) (Open)
Compensation may vary based on the job level and your geographic work location.
Compensation Minimum:$90,200 Annual
Compensation Maximum:$144,500 Annual
Summary:
The Data Scientist I will be an integral member of the Analytical Tools and Data Team within Predictive Analytics, Auto Personal Lines, providing data science support to our current and future suite of analytical tools. This position will enable the team’s ability to serve stakeholders in pricing, product management, loss reserving, and product development by developing predictive and machine learning models to analyze product performance, pricing opportunities and loss development. This position will collaborate with the team’s Principal Data Scientist on Data Science projects, in addition to partners in Business Operations, Data Engineering, and Enterprise Data Science.

Develops, analyzes and models operational, economic, management, accounting and other organizational data to quantify the competitive performance of business segments, evaluate potential operational changes, and design new approaches and methodologies. Analyzes organizational data to recommend solutions to new and complex problems, develops innovative strategies, quantifies the competitive performance of the organization's operations and/or markets; models and evaluates the potential impact of changes. Applies and integrates statistical, mathematical, predictive modeling and business analysis skills to manage and manipulate complex high volume data from a variety of sources.

Job Description:
Primary Accountabilities
Leverages machine learning and predictive modeling projects across a variety of problem domains or business initiatives, building predictive models to support business partner objectives and business needs.
Manipulates and investigates large and complex datasets and formulates data requirements and model specifications needed for development. Incorporates findings and provides industry and competitor insights as part of model development and enhancement
Works closely with business partners and domain experts to identify critical questions.
Working with domain experts, develops problem definition, analytical approach, and research design for modeling projects.
Works with business partners, both internal and external, to identify new opportunities and challenges.
Participates in the selection of research tools and technologies, design of a common research process, and brainstorming new opportunities and methodologies.
Researches and maintains awareness of industry best practices and business strategies.
Proactively brings in new and innovative ideas and approaches to develop business solutions.
Monitors industry and competitor trends to determine potential impact to predictive models.
Leverages emerging technologies, open source tools, and harnesses new mathematical techniques.
Travel Requirements
This position requires travel up to 10% of the time
Education/Licenses/Designations
Preferred: Bachelor’s Degree in Mathematics, Statistics, Physics, Computer Sciences or Engineering, or related field or equivalent experience
Specialized Knowledge & Skills
Demonstrated experience providing customer-driven solutions, support or service.
Ability to work as part of a team and to communicate effectively.
Proficiency in programming languages suitable for database access, scripting, and statistical analysis. Familiarity with version control for software development.
Demonstrated experience using large amounts of structured, semi structured, and unstructured data.
Experience formulating, approaching, analyzing and solving problems on massive datasets.
Solid knowledge managing data to scale using data summarization, query and analysis software and tools.
Additional Job Information:
Candidates should have at least 1-2 years of insurance experience, ideally data science work around risk based pricing, underwriting models, risk portfolio analysis or demand modeling/price elasticity analysis.
Candidates with experience in in Python/R, GCP/AWS, and SQL a plus.
Depending on qualifications, candidates may be considered at different levels.
Offer to selected candidate will be made contingent on the results of applicable background checks.
Offer to selected candidate is contingent on signing a non-disclosure agreement for proprietary information, trade secrets, and inventions
Relocation assistance may be available.
This position is a hybrid role that involves working a minimum of 10 days per month in the office. We know flexibility is important to our employees and their families, and we will continue to offer flexibility in this flex office/home role. This approach will guide us in balancing the needs of the business, customers and our employees.
Preferred locations for this role include:
Madison, WI; Chicago, IL; Boston, MA; Minneapolis, MN; Denver, CO; Phoenix, AZ; Nashville, TN; Atlanta, GA; Seattle, WA; Las Vegas, NV; St. Joseph, MO; Kansas City, MO; St. Louis, MO; Green Bay, WI; Milwaukee, WI; Akron, OH; Keene, NH; Jacksonville, FL
Internal candidates are encouraged to apply regardless of location and will be considered based upon the needs of the role.
#LI-Hybrid
When you work at American Family you can expect benefits that support your physical, emotional, and financial wellbeing. You will have access to comprehensive medical, dental, vision and wellbeing benefits that enable you to take care of your health. We also offer a competitive 401(k) contribution, a pension plan, an annual incentive, and a paid-time off program. In addition, our student loan repayment program and paid-family leave are available to support our employees and their families. Interns and contingent workers are not eligible for American Family Enterprise benefits.
We also consider qualified applicants with criminal histories, consistent with applicable federal, state and local law.

#LI-DB1
To apply to this job, click Apply Now
Show Less
Report",3.2,"American Family Insurance
3.2","Madison, WI",#N/A,5001 to 10000 Employees,1927,Insurance Carriers,Insurance,$5 to $10 billion (USD)
17,#N/A,#N/A,"Overview
The Institute for Defense Analyses (IDA) is a not-for-profit corporation that operates three Federally Funded Research & Development Centers (FFRDCs). IDA’s Systems and Analyses Center is located in Alexandria, Virginia and is comprised of eight research divisions providing objective analyses of national security issues, particularly those requiring scientific and technical expertise, and conducts related research on other national challenges.
The IDA Data Science Fellowship provides recent graduates a unique opportunity to develop and apply data science skills to important issues in national security. The Data Science Fellowship is a project-based learning experience within a variety of research areas. In a collaborative team environment, Fellows perform data manipulation and statistical, econometric, predictive, descriptive, and other quantitative analyses to help answer important sponsor-funded research questions as well as internal-funded business operations questions. In the course of research, Fellows will apply advanced data science tools, possibly including machine learning, artificial intelligence, statistics, or various big data methodologies. Fellows should expect to learn while using their critical thinking, creativity, and analytic skills to contribute to interdisciplinary project teams.
Fellows will have opportunity to work on several research questions during their 3-year terms. Specific future research projects are unpredictable, subject to ever-changing analytical needs of sponsors and/or internal business operations questions. However, example projects include:
Appraisal of current DoD investments in a broad range of areas: from human factors to autonomous systems, from materials science to nuclear weapons effects, from social behaviors to quantum computing;
Analyze and research questions on DoD personnel, military readiness and efficacy, and organizational efficiency topics.
Assessment of federal agency information and computing architectures that support data science applications (i.e., large, distributed data sets and computational assets);
Application of data exploration, text analytics, forecasting, statistical inference, simulation to areas of military personnel, manpower, and acquisition of DOD weapon systems.
Improve IDA’s data architecture to support efficient internal operations
Analyze financial information to surface insights about research project execution across the company and inform decision-making
Over the course of the three-year program, fellowship experiences will include:
Involvement in workshops and discussions on relevant topics
Mentorship from members of the IDA research staff
Training on specific analytical methods and tools
Attendance and presentation at professional society and/or academic meetings/conferences
Qualifications
This is a full-time position and is only open to recent recipients of a bachelor’s or master’s degree. Candidates with degrees higher than a master’s degree will not be considered.
Candidates with recent Bachelor’s degree or Masters’ degree in economics, statistics, operations research, mathematics, physics, computer science, data science, data engineering, political science or other disciplines with a strong foundation in statistics and/or applied mathematics are encouraged to apply.
Candidates must demonstrate experience with one or more programming languages or statistical software used in IDA’s research (e.g., Python, R, Julia, Stata, MATLAB, C, Java, etc.)
Candidates must demonstrate strong written and oral communication skills. Ideal candidates are able to contribute to and support team efforts.
Additional preferred skills include:
Training and/or experience in quantitative or qualitative information collection, data normalization, or text analytics.
Experience as a research assistant in an academic or policy research setting
Experience in data engineering and/or database management
Experience or coursework in Bayesian statistics, machine learning, predictive analytics, and/or geospatial analyses
U.S. citizenship is required
Candidates selected for employment are required to successfully complete a criminal background check.
Candidates that are selected for employment are expected to start employment between May and July 2023.
In addition to the application, applicants at later stages in the process will be required to submit the following:
Code Sample, GitHub link or quantitative research writing sample —a code sample is preferred, but a writing sample from a research project or assignment demonstrating quantitative analytical ability is acceptable.
Writing Sample — a single page personal statement describing your interest in the Data Science Fellowship or a writing sample from a research project or assignment. (Not required if a writing sample was submitted for requirement 1.)
Transcripts — an unofficial transcript is acceptable for consideration, but an official transcript is needed before any offer of employment will be made.
Contact Information for 2 Academic/Professional References or 2 Letters of Academic Recommendation — references must include name, position, phone number, email address. Letters must be signed by the individual serving as the reference and delivered in PDF format.
U.S. Citizenship is required

Ability to obtain and maintain a security clearance is required

IDA is an equal opportunity employer committed to providing a fair recruiting process and working environment free from discrimination. All qualified applicants will receive consideration for employment without regard to race, color, religion, sex, sexual orientation, gender identify, national origin, disability or protected veteran status. Click here to learn more about IDA's commitment to diversity, equity, and inclusion.
Start your job application: click Apply Now
Show Less
Report",4.2,"Institute for Defense Analyses
4.2","Alexandria, VA",#N/A,1001 to 5000 Employees,1956,National Agencies,Government & Public Administration,Unknown / Non-Applicable
18,#N/A,#N/A,"Freeport-McMoRan is a leading international mining company with headquarters in Phoenix, Arizona. We operate large, long-lived, geographically diverse assets with significant proven and probable reserves of copper, gold, and molybdenum. The company has a dynamic portfolio of operating, expansion and growth projects in the copper industry. Freeport-McMoRan is one of the world’s largest publicly traded copper producers, the world’s largest producer of molybdenum and a significant gold producer. We have a long and successful history of conducting our business in a safe, highly efficient and socially-responsible manner. We have the assets, the talent, the drive and the financial strength to provide attractive and rewarding careers of our employees. We encourage you to take the time to explore the opportunity to advance your career at Freeport-McMoRan.
We have the assets, the talent, the drive and the financial strength to provide attractive and rewarding careers of our employees. We encourage you to take the time to explore the opportunity to advance your career at Freeport-McMoRan.
Please note: This position has the possibility of working remotely within 150 miles of Phoenix, Arizona for a percentage of the scheduled work time, as determined by the supervisor. If hired, you will be required to comply with Freeport-McMoRan’s requirement of all employees who are working or attending a meeting onsite at a corporate office location, to submit proof that they are fully vaccinated against COVID-19 prior to entry, unless the company has granted them a medical or religious accommodation.
Description
You will be a data science practice leader within a fast-growing Data Science team pursuing a vision of analytics-driven mining at Freeport. You will work in close collaboration with global business leaders, mining operations, subject matter experts, data scientists, and software engineers to develop novel approaches to complex problems. As a practice leader you will develop and lead multiple data science projects within a practice area. Responsibilities will include strategic development, project planning, people development, solution development, and communication planning. Your data analysis, modeling skills, communication, and leadership skills will be an invaluable part of innovation at Freeport.
Collaborate with business leaders to understand business requirements and manage all aspects of a data science project.
Develop and Lead a team of Data Science Analysts and Data Scientists in collaboration with other expertise to design and implement complex algorithms and industrialize solutions at scale. Ensure team delivers on commitments by defining clear analytical strategies and principles, maintaining a roadmap for execution, and actively secure its implementation through the scrum process.
Utilize modern cloud technologies and employ best practices from DevOps/MLOps to manage all aspects of the Solution Development Lifecyle, including but not limited to, code optimization, sustainment, sunset, and obsolescence. Proactively adapting team makeup to increase project velocity.
Guide problem solving sessions, ensuring alignment to North Star and flexibly seek out R&D initiatives or training opportunities to broaden experience. Provide mentorship and coaching to junior team members.
Collaborate with a wide range of technical and business experts to craft and deliver a communication strategy that creates broad awareness of data science capabilities and its strategic value to business outcomes
Qualifications
Minimum Requirements:
This position requires air travel. In accordance with Freeport-McMoRan’s requirement for all employees whose job requires travel by air, if you are hired you will be required to submit proof that you are fully vaccinated against COVID-19 in order to travel by air, unless the company has granted a medical or religious accommodation.
Bachelor’s degree in a technical engineering or analytical field (Statistics, Mathematics, etc.) or related discipline and seven (7) years of relevant work experience, OR
Master’s degree in a technical engineering or analytical field (Statistics, Mathematics, etc.) or related discipline and five (5) years of relevant work experience OR
Ph.D. in a technical engineering or analytical field (Statistics, Mathematics, etc.) or related discipline and two (2) year of relevant work experience
Python and SQL Programming Experience
Expert Practitioner of at least three of the following analytical areas and the ability to articulate theoretical concepts from at least four
Statistics & Statistical Modeling, including Time-Series Modeling
Simulation Techniques, including MCMC or an equivalent
Neural Networks / Deep Learning
Tree Based Machine Learning Algorithms
Unsupervised Learning
Classification techniques, including Support Vector Machines or an equivalent
Optimization Heuristics
Text Analytics
Ability to visualize data utilizing programmatic techniques
Expert at executing the Data Science development workflow including data manipulation and cleaning, feature engineering, model selection, model training, model validation and model deployment
Experience influencing and building mindshare convincingly with any audience. Confident and experienced in public speaking to large audiences and storytelling with data.
Experience developing and leading teams

Preferred Qualifications:
Working knowledge of MLOps/DevOps concepts (Version Control, CI/CD, Trunk Based Development/PR Based Development/GIT, Test driven development)
Working knowledge of Azure Machine Learning Environment
Working knowledge of Software Engineering and Object Orient Programming Principles
Working knowledge of Distributed Parallel Processing Environments such as Spark or Snowflake
Working knowledge of Edge Analytics, embedded systems, or computer vision.
Working knowledge of Data Architecture, engineering, and ETL teams
Working knowledge of problem solving/root cause analysis on Production workloads
Working knowledge of Agile, Scrum, and Kanban
Strong verbal and written skills in English language.

Criteria/Conditions:
Position is in busy, non-smoking office located in downtown Phoenix, AZ
Location requires mobility in an office environment; each floor is accessible by elevator. Occasionally work will be performed in a mine, outdoor or manufacturing plant setting.
Must be able to frequently sit, stand and walk.
Must be able to frequently lift and carry up to 10 pounds.
Must be able to work in a potentially stressful environment.
Personal protective equipment is required when performing work in a mine, outdoor, manufacturing or plant environment, including hard hat, hearing protection, safety glasses, safety footwear, and as needed, respirator, rubber steel-toe boots, protective clothing, gloves and any other protective equipment as required.
Freeport-McMoRan promotes a drug/alcohol-free work environment through the use of mandatory pre-employment drug testing and on-going random drug testing as allowed by applicable state laws
Freeport-McMoRan has reviewed the jobs at its various office and operating sites and determined that many of these jobs require employees to perform essential job functions that pose a direct threat to the safety or health of the employees performing these tasks or others. Accordingly, the Company has designated the following positions as safety-sensitive:
Site-based positions, or positions which require unescorted access to site-based operational areas, which are held by employees who are required to receive MSHA, OSHA, DOT, HAZWOPER and/or Hazard Recognition Training; or
Positions which are held by employees who operate equipment, machinery or motor vehicles in furtherance of performing the essential functions of their job duties, including operating motor vehicles while on Company business or travel (for this purpose ""motor vehicles"" includes Company owned or leased motor vehicles and personal vehicles used by employees in furtherance of Company business or while on Company travel); or
Positions which Freeport-McMoRan has designated as safety sensitive positions in the applicable job or position description and which upon further review continue to be designated as safety-sensitive based on an individualized assessment of the actual duties performed by a specifically identified employee.
Equal Opportunity Employer/Protected Veteran/Disability
Show Less
Report",4.0,"Freeport McMoRan
4.0","Phoenix, AZ",#N/A,10000+ Employees,#N/A,Mining & Metals,"Energy, Mining & Utilities",$10+ billion (USD)
19,#N/A,#N/A,"Job Description:
Metron is an employee-owned company dedicated to delivering innovative solutions for the most challenging national security problems. For over 35 years, our principled approach to problem-solving has yielded creative solutions at the intersection of advanced mathematics, computer science, physics, and engineering. Our people are leaders in their technical fields and are passionate about solving challenging problems. We look for individuals who share this same passion and can apply their experience in real-world settings.

RESILIENT MISSION AUTONOMY
Our autonomous systems team is adding a talented applied research scientist with a background in autonomous systems, robotics, and/or machine learning. Our team is dedicated to creating resilient mission autonomy via the development of technologies that increase the reliability and longevity of unmanned vehicles in some of the world’s most demanding environments, on some of the most complex of missions. The successful candidate will be passionate about designing, developing, and applying cutting-edge autonomy for vehicle prototypes.
In this position, you will develop and contribute ideas for autonomous vehicles in navigation, command and control, route and motion planning, artificial intelligence, and decision making. You will be part of a team of scientists and software engineers that designs and implements advanced vehicle autonomy. You will integrate into, and lead, dynamic and highly motivated project teams, and use new ideas from across multiple fields to push the boundaries of the possible for intelligent systems.

Required Qualifications
Master’s degree in computer science, robotics, mathematics, physics, or applicable engineering field
At least 2 years of relevant autonomous systems experience
Object-oriented programming proficiency
Ability to work both collaboratively as part of a team and independently with minimal supervision
US CITIZENSHIP REQUIRED; successful candidates will be subject to a security investigation and must meet eligibility requirements to obtain and maintain a security clearance
Desired Qualifications:
Experience in applied R&D environments and with rapid software prototyping
Experience in autonomy and autonomous decision making, underwater navigation, automated planning, and/or machine learning
Experience programming in modern C++, Java, Matlab, or Python
Ability to improvise and think “outside the box” to develop technical solutions
A track record of publications and/or successful proposal writing

Position Location: Reston, VA

Workplace Safety
Metron follows the CDC and OSHA guidance for workplace safety. Metron expects all employees to be vaccinated against COVID-19 unless they have an exemption for an underlying medical condition or strong religious conviction. We also listen to our employees to create a safe and workable office environment for everyone. Metron continues to support flexible/hybrid telecommuting options when project work allows for working from home. If you have any questions about the safety precautions we are taking, we encourage you to ask during the interview process.

Perks and Benefits
Medical, Dental and Vision Insurance
Accompanying FSA and HSA options
Additional Voluntary Benefits
Paid Time Off
9 Observed Holidays and 2 Floating Holidays
Paid Parental Leave
Tuition Reimbursement
Professional Development Reimbursement
Annual Salary Reviews
Profit Sharing
401(k) Traditional and Roth Options
Gym and Fitness Reimbursement
Employee Assistance Program
Employee Referral Program

All qualified applicants will receive consideration for employment and will not be discriminated against on the basis of race, color, religion, sex, sexual orientation, gender identity, national origin, age, disability, or protected veteran status. Metron takes affirmative action in support of its policy to employ and advance in employment individuals who are minorities, women, protected veterans, and individuals with disabilities.
VEVRAA Federal Contractor
Show Less
Report",4.1,"Metron, Inc.
4.1","Reston, VA",#N/A,201 to 500 Employees,1982,Research & Development,Management & Consulting,$25 to $100 million (USD)
